{
  "id": "fq",
  "category_id": "data_processing",
  "description": "`jq` for binary formats — tool, language and decoders for working with binary and text formats",
  "url": "https://github.com/wader/fq",
  "has_musl": false,
  "binaries": [
    {
      "id": 1,
      "name": "fq",
      "version_cmdline": "--version",
      "is_main": true
    }
  ],
  "assets": [
    {
      "id": 1,
      "type": "archive",
      "contains": "linux_amd64",
      "ends_with": ".tar.gz"
    }
  ],
  "shell_completions": [],
  "man_pages": []
}
