{
  "id": "btop",
  "category_id": "system",
  "description": "A monitor of resources (`top` / `htop` alternative)",
  "url": "https://github.com/aristocratos/btop",
  "has_musl": true,
  "binaries": [
    {
      "id": 1,
      "name": "btop",
      "version_cmdline": "--version",
      "is_main": true
    }
  ],
  "assets": [
    {
      "id": 1,
      "type": "archive",
      "contains": "x86_64-unknown-linux-musl",
      "ends_with": ".tar.gz"
    }
  ],
  "shell_completions": [],
  "man_pages": []
}
