{
  "id": "agg",
  "category_id": "docs_diag",
  "description": "Generate animated GIFs from `asciinema` session recordings",
  "url": "https://github.com/asciinema/agg",
  "has_musl": true,
  "binaries": [
    { "id": 1, "name": "agg", "version_cmdline": "--version", "is_main": true }
  ],
  "assets": [
    { "id": 1, "type": "binary", "equals": "agg-x86_64-unknown-linux-musl" }
  ],
  "shell_completions": [],
  "man_pages": []
}
